AUTHORS,TITLE,DOI,VENUE
Deepika Badampudi,Reporting Ethics Considerations in Software Engineering Publications.,10.1109/ESEM.2017.32,ESEM2017
"Kwabena Ebo Bennin, Jacky Keung, Akito Monden, Passakorn Phannachitta, Solomon Mensah",The Significant Effects of Data Sampling Approaches on Software Defect Prioritization and Classification.,10.1109/ESEM.2017.50,ESEM2017
"Yi Bin, Kai Zhou, Hongmin Lu, Yuming Zhou, Baowen Xu",Training Data Selection for Cross-Project Defection Prediction - Which Approach Is Better?,10.1109/ESEM.2017.49,ESEM2017
"Eduardo Cunha Campos, Marcelo de Almeida Maia",Common Bug-Fix Patterns - A Large-Scale Observational Study.,10.1109/ESEM.2017.55,ESEM2017
"Amirton Bezerra Chagas, Fabio Almeida Melo, Walter Felipe dos Santos, Adriana Almeida Nascimento de Oliveira, Sarita Monteiro Bora, Fabio Queda Bueno da Silva",Analysis of the Understanding of the Concepts of Task and Skill Variety by Software Engineering Professionals.,10.1109/ESEM.2017.33,ESEM2017
"Maya Daneva, Chong Wang, Patrick Hoener",What the Job Market Wants from Requirements Engineers? An Empirical Analysis of Online Job Ads from the Netherlands.,10.1109/ESEM.2017.60,ESEM2017
"Jorge Echeverría, Francisca Pérez, José Ignacio Panach, Carlos Cetina, Oscar Pastor",The Influence of Requirements in Software Model Development in an Industrial Environment.,10.1109/ESEM.2017.41,ESEM2017
