AUTHORS,TITLE,DOI,Venue
"Yingfei Xiong, Xinyuan Liu, Muhan Zeng, Lu Zhang, Gang Huang",Identifying patch correctness in test-based program repair,,ICSE2018
"Junwen Yang, Pranav Subramaniam, Shan Lu, Cong Yan, Alvin Cheung",How not to structure your database-backed web applications: a study of performance bugs in the wild,,ICSE2018
"Zhifei Chen, Bihuan Chen, Lu Xiao, Xiao Wang, Lin Chen, Yang Liu, Baowen Xu",Speedoo: prioritizing performance optimization opportunities,,ICSE2018
"Sergio Segura, José Antonio Parejo, Javier Troya, Antonio Ruiz Cortés",Metamorphic testing of RESTful web APIs,,ICSE2018
"Narayan Ramasubbu, Chris F. Kemerer",Integrating technical debt management and software quality management processes: a framework and field tests,,ICSE2018
"Shaowei Wang, Tse-Hsun Chen, Ahmed E. Hassan",Understanding the factors for fast answers in technical Q&A websites: an empirical study of four stack exchange websites,,ICSE2018