AUTHORS,TITLE,DOI,Venue
"Jun-Wei Lin, Reyhaneh Jabbarvand, Joshua Garcia, Sam Malek",Nemo: multi-criteria test-suite minimization with integer nonlinear programming,,ICSE2018
"Amritanshu Agrawal, Tim Menzies","Is ""better data"" better than ""better data miners""?: on the benefits of tuning SMOTE for defect prediction",,ICSE2018
"Neil C. Borle, Meysam Feghhi, Eleni Stroulia, Russell Greiner, Abram Hindle",Analyzing the effects of test driven development in GitHub,,ICSE2018
"Hila Peleg, Sharon Shoham, Eran Yahav",Programming not only by example,,ICSE2018
"Renzo Degiovanni, Pablo F. Castro, Marcelo Arroyo, Marcelo Ruiz, Nazareno Aguirre, Marcelo F. Frias",Goal-conflict likelihood assessment based on model counting,,ICSE2018
"Juan de Lara, Esther Guerra","A posteriori typing for model-driven engineering: concepts, analysis, and applications",,ICSE2018
"Sooyoung Cha, Seongjoon Hong, Junhee Lee, Hakjoo Oh",Automatically generating search heuristics for concolic testing,,ICSE2018